company_name,name,description,link,start_date,host_company_domains,image,tweet_link,tweet_text,webinar_link,image_link,word
BlueVoyant,,,,,,,https://twitter.com/BlueVoyant/status/1273238969870954497,Will you be attending tomorrow's @DataConnectors Virtual Sacramento Cybersecurity Conference? We're sponsoring the event and hope to meet you there! Sign-up now to secure your place: https://t.co/LlEfbtxXh4 #virtualevent #dataconnectors https://t.co/XxMYrz098h,https://www.dataconnectors.com/events/sacramento2020/,http://pbs.twimg.com/media/Eas5R1lXYAExFJj.jpg,conference
BlueVoyant,,,,,,,https://twitter.com/BlueVoyant/status/1272906783300845568,"Don’t miss the @DataConnectors Virtual Sacramento Cybersecurity Summit this week on Thursday, June 18th.  Our team will be attending and hope to “e-meet” you there. Register now: https://t.co/LlEfbtPy8C #dataconnectors #cybersecurity https://t.co/AHvhAZN4mi",https://www.dataconnectors.com/events/sacramento2020/,http://pbs.twimg.com/media/EaoWcztXgAAIvTn.jpg,summit
BlueVoyant,,,,,,,https://twitter.com/BlueVoyant/status/1272547101990367232,"Whether you’re in IT, Security, DevOps or an Admin &amp; Data Architect, #SplunkLive! Virtual has something for you. We’re excited to be sponsors for this year’s event, but don’t take our word for it. See for yourself and join us here: https://t.co/bfucafqbtP https://t.co/9WYDWoI49W",http://splk.it/SplunkLive,http://pbs.twimg.com/media/Eaj-usFWAAM5CSN.jpg,event
BlueVoyant,,,,,,,https://twitter.com/BlueVoyant/status/1270324770207399936,We're looking forward to meeting you virtually tomorrow at @DataConnectors Boston Cybersecurity Summit. Sign-up for your FREE pass: https://t.co/yPQ5UZXrPV https://t.co/HtLWgZtQ5w,https://www.dataconnectors.com/events/boston2020/,http://pbs.twimg.com/media/EaDqCx8XsAERylN.jpg,summit
BlueVoyant,,,,,,,https://twitter.com/BlueVoyant/status/1268225937889525760,"A multilayer approach to prevention is your best defense against sophisticated cyber attacks. Find out how our advanced cyber #threatintelligence, managed security services, and proactive professional services can help you stay ahead of attacks: https://t.co/wwRZ6ypdM9 #MSS https://t.co/ghk5lsMKdi",https://www.bluevoyant.com/what-we-do/working-with-us,http://pbs.twimg.com/media/EZmgDPMWoAEqM9N.jpg,event
BlueVoyant,,,,,,,https://twitter.com/BlueVoyant/status/1268150440056807425,We're looking forward to meeting you virtually at @DataConnectors Seattle &amp; Portland Cybersecurity Summit. Sign-up for your FREE pass: https://t.co/Ay2YcQPm8n https://t.co/NBBqvxWv0w,https://www.dataconnectors.com/events/seattle-portland-2020/,http://pbs.twimg.com/media/EZlBOoOXYAA03cg.jpg,summit
BlueVoyant,,,,,,,https://twitter.com/BlueVoyant/status/1265606653388480512,Will you be attending tomorrow’s @DataConnectors Canada-East Virtual Cybersecurity Summit? We will be sponsoring the event and hope to “e-meet” you there. Sign-up for your FREE pass here: https://t.co/gq5F4t12x8 https://t.co/uhHw1vaNEY,https://www.dataconnectors.com/events/canada-east2020/,http://pbs.twimg.com/media/EZBWVspWAAALD63.jpg,summit
BlueVoyant,,,,,,,https://twitter.com/BlueVoyant/status/1265239743152955393,Join us on May 28th at the virtual @DataConnectors Canada-East Cybersecurity Summit. We will be sponsoring the event and hope to “e-meet” you there. Register for your FREE pass: https://t.co/gq5F4t12x8 https://t.co/k9qPny5HeH,https://www.dataconnectors.com/events/canada-east2020/,http://pbs.twimg.com/media/EY8Ix2MXYAAA1T5.jpg,summit
BlueVoyant,,,,,,,https://twitter.com/BlueVoyant/status/1263510837261729792,The first 72 hours following the discovery of a breach are critical for your organization’s resiliency and future. Learn how BlueVoyant’s Cyber Forensics and #IncidentResponse team can help you make the necessary decisions in the event of a breach: https://t.co/Dz45qmo3mi https://t.co/mX0WJyt8Cd,https://www.bluevoyant.com/cyber-forensics-incident-response,http://pbs.twimg.com/media/EYjkHJAXQAEGWjD.jpg,event
BlueVoyant,,,,,,,https://twitter.com/BlueVoyant/status/1262352394391822341,Will we see you tomorrow at the virtual Data Connectors Tampa Cybersecurity Summit? We will be logged in. #BlueVoyant #dataconnectors #cybersecurity https://t.co/QnffN1o2uz,,http://pbs.twimg.com/media/EYTGz54XYAEMPEJ.png,summit
BlueVoyant,,,,,,,https://twitter.com/BlueVoyant/status/1260540598580326401,Are you logging into the Data Connectors Virtual Minneapolis &amp; Des Moines Cybersecurity Summit tomorrow? We look forward to “e-meeting” you. #BlueVoyant #dataconnectors #cybersecurity https://t.co/Ez3oy0bvAM,,http://pbs.twimg.com/media/EX5W_hkWkAEj1qA.png,summit
BlueVoyant,,,,,,,https://twitter.com/BlueVoyant/status/1260223698587566080,We’d like to meet you next week at the virtual Data Connectors Tampa Cybersecurity Summit. Join us online on May 19th. #BlueVoyant #dataconnectors #cybersecurity https://t.co/0wUMkhP7WW,,http://pbs.twimg.com/media/EX02xiWXQAAEQfY.png,summit
BlueVoyant,,,,,,,https://twitter.com/BlueVoyant/status/1258366050997014529,Don’t miss the Data Connectors Virtual Minneapolis &amp; Des Moines Cybersecurity Summit next week on May 14th. We’re attending and would like to “meet” you. #BlueVoyant #dataconnectors #cybersecurity https://t.co/BXwpcljRex,,http://pbs.twimg.com/media/EXadQKbXQAEzU_X.png,summit
BlueVoyant,,,,,,,https://twitter.com/BlueVoyant/status/1258049243899744256,We’re logging in tomorrow to the virtual Data Connectors Philadelphia Cybersecurity Summit. Will you be there? #BlueVoyant #dataconnectors #cybersecurity https://t.co/yLIXyRCqJr,,http://pbs.twimg.com/media/EXV9Hh2VAAgslAF.png,summit
BlueVoyant,,,,,,,https://twitter.com/BlueVoyant/status/1255829511519842304,"Philadelphia, here we come...virtually that is! We look forward to meeting you at the Data Connectors Philadelphia Cybersecurity Summit on May 7th. #BlueVoyant #dataconnectors #cybersecurity https://t.co/uHAvF0HHcK",,http://pbs.twimg.com/media/EW2aSJ8WAAExnSH.png,summit
BlueVoyant,,,,,,,https://twitter.com/BlueVoyant/status/1255512547836530705,We look forward to virtually “e-meeting” you tomorrow at the Data Connectors Chicago Cybersecurity Summit. #BlueVoyant #dataconnectors #cybersecurity https://t.co/WUpucAqdXT,,http://pbs.twimg.com/media/EWx6AcNWoAM08Jy.png,summit
BlueVoyant,,,,,,,https://twitter.com/BlueVoyant/status/1253338267254054913,Will we see you at the virtual Data Connectors Chicago Cybersecurity Summit on April 30th? We will be logged in. #BlueVoyant #dataconnectors #cybersecurity https://t.co/hyNPxlF0AZ,,http://pbs.twimg.com/media/EWTAgj3UYAEHWY1.png,summit
BlueVoyant,,,,,,,https://twitter.com/BlueVoyant/status/1252975736367046658,Meet us virtually tomorrow at the Data Connectors Louisville Cybersecurity Summit. #BlueVoyant #dataconnectors #cybersecurity https://t.co/IeNsQPJWrx,,http://pbs.twimg.com/media/EWN2ylQWkAA_0RY.png,summit
BlueVoyant,,,,,,,https://twitter.com/BlueVoyant/status/1250861908334428161,We’re excited to virtually meet you next week at the Data Connectors Louisville Cybersecurity Summit on April 23rd. #BlueVoyant #dataconnectors #cybersecurity https://t.co/7YRGRFajPe,,http://pbs.twimg.com/media/EVv0RmAWsAQbljI.png,summit
BlueVoyant,,,,,,,https://twitter.com/BlueVoyant/status/1248309989955055619,Are you attending the Virtual Portland Data Connectors Cybersecurity Summit next week on April 16th? We’re attending and would like to virtually “meet” you. #BlueVoyant #dataconnectors #cybersecurity https://t.co/ynjPX208hs,,http://pbs.twimg.com/media/EVLjUU2UMAUrktL.png,summit
BlueVoyant,,,,,,,https://twitter.com/BlueVoyant/status/1247902270596898819,Are you logging into the Data Connectors Virtual Hartford Cybersecurity Summit tomorrow? We look forward to “e-meeting” you. #BlueVoyant #dataconnectors #cybersecurity https://t.co/RjkUuhgTqa,,http://pbs.twimg.com/media/EVFwf24UEAUml8h.png,summit
BlueVoyant,,,,,,,https://twitter.com/BlueVoyant/status/1245682612280209410,We’re excited to virtually meet you at the Data Connectors Los Angeles Cybersecurity Summit today. #BlueVoyant #dataconnectors #cybersecurity https://t.co/sfgkNTzINs,,http://pbs.twimg.com/media/EUmNu6EX0AAmLdj.png,summit
BlueVoyant,,,,,,,https://twitter.com/BlueVoyant/status/1245395733160898560,Are you logging into the Data Connectors Virtual Los Angeles Cybersecurity Summit tomorrow? We look forward to “e-meeting” you. #BlueVoyant #dataconnectors #cybersecurity https://t.co/gkXdtz9OzP,,http://pbs.twimg.com/media/EUiI0URXkAEiO-B.png,summit
