company_name,name,description,link,start_date,host_company_domains,image,tweet_link,tweet_text,webinar_link,image_link
Course5i,Webinar : How Lenovo Strengthens Customer Relationships with Analytics,Webinars and Webcasts,https://www.course5i.com/webinars/strengthen-customer-relationships-with-analytics/,,,http://pbs.twimg.com/ext_tw_video_thumb/1412485781118095365/pu/img/9oSdvC4liPDI0U50.jpg,https://twitter.com/Course5i/status/1412485852102467591,"In our latest webinar, we found out ‘How @Lenovo  Strengthens Customer Relationships with Analytics’. 
Watch the recording to know more: https://t.co/29cENChLf5
#StrengtheningCustomerAnalytics #analytics #webinar  #Course5ToTransformation #ecommerce #Course5AI #Course5Analytics https://t.co/ALh4SjiAWe",,
Course5i,Webinar : QUICK But Not DIRTY: Agile Research Challenges and the Way Forward,Webinars and Webcasts,https://www.course5i.com/webinars/agile-research-challenges-and-the-way-forward/,2021-04-29T00:00:00+00:00,,http://pbs.twimg.com/media/E0Jq15MVoAI2hx1.jpg,https://twitter.com/Course5i/status/1387789206550761475,"We are #LIVE! Join the ongoing webinar with #CPG industry’s best insiders Christian Niederauer, Silky Rout, and @josephsursock as they discuss the exciting dynamics around Agile market research. Live here: https://t.co/rsRR6tuQIy 
#AcingAgileResearch #Course5ToTransformation https://t.co/Ecx8UeOkLl",,
Course5i, ,"Enjoy the videos and music you love, upload original content, and share it all with friends, family, and the world on YouTube.",https://www.youtube.com/watch,2021-01-01T00:00:00+00:00,,http://pbs.twimg.com/media/EpdSdtVVgAENnGb.jpg,https://twitter.com/Course5i/status/1339630668012158978,"What’s different about TV viewer preferences across Network TV, Basic Cable, Premium Cable, and SVOD? Michael Haggerty from ViacomCBS shared recent research findings on the TV viewer’s mindset &amp; viewing patterns in 2020. Watch the webinar recording: https://t.co/uhliwerW43 https://t.co/Ad7HIVU00w",,
Course5i,Webinar : Accelerate Speed to Insight. Go to Market Smarter.,Webinars and Webcasts,https://www.course5i.com/webinars/accelerate-speed-to-insight/,,,http://pbs.twimg.com/media/EjGsRDtVkAANwro.jpg,https://twitter.com/Course5i/status/1311018528842031105,"Can you further accelerate your #researchoperations? Catch a recording of our webinar ‘Accelerate Speed to Insight. Go to Market Smarter.’ to see how we use #NLP &amp; #ML to expedite survey scripting &amp; data processing https://t.co/VHNqHJqCbU
Get a custom demo https://t.co/JVQ3YbDBh9 https://t.co/yUlfDpvoUS",,
